{
  "job_id": "phase4-live-generic-agent",
  "run_id": "2026-06-21-phase-4-live-generic-agent-smoke",
  "agent": "generic-cli-agent",
  "adapter": "generic-cli-agent",
  "status": "succeeded",
  "input_file": "input.json",
  "output_file": "output.json",
  "raw_log_file": "raw.log",
  "created_at": "2026-06-21T08:14:28Z",
  "started_at": "2026-06-21T08:14:28Z",
  "completed_at": "2026-06-21T08:14:28Z",
  "timeout_seconds": 30,
  "error_reason": null,
  "provenance": {
    "agent": "generic-cli-agent",
    "adapter_version": "0.1.0",
    "runtime": "local-cli"
  }
}
